{
  "QJ_classification": {
    "QJ0_gravitational_absolute_vacuum": "open",
    "QJ0_normalized_connected_QFT_common_constant": "quotiented",
    "QJ1_local_formal_anchor_scheme": "closed_constructively",
    "QJ1_same_source_morphism_implication": "closed_exactly",
    "QJ1_selected_physical_q79_law": "open_morphism_existence",
    "QJ2_local_formal_action_Hessian": "closed_constructively",
    "QJ2_physical_normalized_Hessian": "open_tangent_metric_and_morphism_existence",
    "QJ2_same_source_action_jet_implication": "closed_exactly",
    "new_sharp_exit": "construct one selected same-root state/action projection map with its tangent pairing"
  },
  "T35_execution": {
    "H_over_Lambda": "1.3211016293754684937241140791004495525427156531826718660431761370691619814324325",
    "H_squared_over_Lambda_squared": "1.7453095151385177185351833627423326105972038607898213139211878958779922997321935",
    "QJ1_orbit_direction": {
      "delta_lambda_over_kappa_per_t": "1",
      "delta_m2_over_kappa_Lambda2_per_t": "-3.4906190302770354370703667254846652211944077215796426278423757917559845994643870",
      "hessian_shift_over_kappa_Lambda2_per_t": "13.9624761211081417482814669019386608847776308863185705113695031670239383978575480",
      "symbolic": "(-2 H^2,1)",
      "tadpole_shift_over_kappa_Lambda3_per_t": "0.000000000000000000000000000000000000000000000000000000000000000000000000000000328312504405258508101"
    },
    "QJ1_orbit_hessian_is_nonzero": true,
    "QJ1_orbit_tadpole_is_zero": true,
    "T35_higher_jets_retained": true,
    "bare_tadpole_over_kappa_Lambda3": "-100.114483627430279588255506887696895827724576220833743543915782457764101035430506698860949",
    "counterterm_tadpole_over_kappa_Lambda3": "100.1144836274302795882555068876968958277245762208337435439157824577641010354304941567856418563903376",
    "matched_tadpole_is_zero_to_locked_precision": true,
    "matched_tadpole_residual": "-0.0000000000000000000000000000000000000000000000000000000000000000000000000000125420753071436096624",
    "unique_T39_delta_lambda_over_kappa": "27.378618796640755205528363179817484496677926703979373100574185483012425714240522",
    "unique_T39_delta_m2_over_kappa_Lambda2": "-57.677797118443725188553711550295305100654425517725575708086889110399918032625748"
  },
  "check_summary": {
    "failed": [],
    "passed": 74,
    "total": 74
  },
  "checks": {
    "A35_action_weight_open": true,
    "A35_radial_coordinate_closed": true,
    "Action_Ward_does_not_select": true,
    "PPA_does_not_select_total_action": true,
    "QJ0_gravity_open": true,
    "QJ1_QJ2_full_nonconstant_rank": true,
    "QJ1_QJ2_not_numeric_knobs": true,
    "QJ1_kernel_first_zero": true,
    "QJ1_kernel_second_nonzero": true,
    "QJ1_morphism_implication_closed": true,
    "QJ1_one_morphism_implication": true,
    "QJ1_physical_open": true,
    "QJ1_rank_one": true,
    "QJ1_violating_counterexample": true,
    "QJ2_metric_open": true,
    "QJ2_same_morphism_implication": true,
    "QME_does_not_select": true,
    "QME_scheme_exists": true,
    "QME_zero_anomaly": true,
    "SP_freedom_remains": true,
    "T35_QJ1_orbit_hessian_nonzero": true,
    "T35_QJ1_orbit_tadpole_zero": true,
    "T35_bare_tadpole_nonzero": true,
    "T35_higher_jets_retained": true,
    "T35_tadpole_matched": true,
    "T39_unique_given_morphism": true,
    "Ward_does_not_select": true,
    "classical_on_shell_is_not_quantum_selector": true,
    "field_independence_does_not_select": true,
    "full_state_need_not_be_unique": true,
    "global_flow_not_required": true,
    "morphism_existence_open": true,
    "one_structural_exit": true,
    "orbit_witness_det_54": true,
    "packet_acceptance_unchanged": true,
    "physical_QJ1_not_promoted": true,
    "physical_QJ2_not_promoted": true,
    "physical_endpoint_not_promoted": true,
    "projection_is_pointed": true,
    "provider_requires_action_pushforward": true,
    "provider_requires_fixedpoint_hessian": true,
    "provider_requires_normalization": true,
    "provider_requires_one_root": true,
    "radial_marginal_unique": true,
    "row_acceptance_unchanged": true,
    "schema_claim_id": true,
    "schema_requires_all_packet_fields": true,
    "source_01_hash_matches": true,
    "source_02_hash_matches": true,
    "source_03_hash_matches": true,
    "source_04_hash_matches": true,
    "source_05_hash_matches": true,
    "source_06_hash_matches": true,
    "source_07_hash_matches": true,
    "source_08_hash_matches": true,
    "source_09_hash_matches": true,
    "source_10_hash_matches": true,
    "source_11_hash_matches": true,
    "source_12_hash_matches": true,
    "source_13_hash_matches": true,
    "source_14_hash_matches": true,
    "source_15_hash_matches": true,
    "source_16_hash_matches": true,
    "source_17_hash_matches": true,
    "source_18_hash_matches": true,
    "split_Ward_does_not_select": true,
    "state_pushforward_open": true,
    "symbolic_det_16H3": true,
    "theorem_keeps_endpoint_open": true,
    "theorem_states_8H2_obstruction": true,
    "theorem_states_contract_not_existence": true,
    "zero_new_discrete_selectors": true,
    "zero_new_physical_parameters": true,
    "zero_observed_inputs": true
  },
  "claim_id": "CBF.T40",
  "date": "2026-08-30",
  "finite_counterterm_orbit": {
    "QJ1_kernel_dimension_mod_constants": 1,
    "QJ1_kernel_first_derivative": "0",
    "QJ1_kernel_polynomial_mod_constants": "(h^2-H^2)^2",
    "QJ1_kernel_second_derivative": "18",
    "QJ1_kernel_vector_a_b": [
      "-9/2",
      "1"
    ],
    "QJ1_map_rank": 1,
    "QJ1_plus_QJ2_kernel_mod_constants": 0,
    "QJ1_plus_QJ2_rank": 2,
    "QJ1_violating_first_derivative": "3",
    "QJ1_violating_second_derivative": "2",
    "QJ1_violating_vector_a_b": [
      "1",
      "0"
    ],
    "constant_is_quotiented_in_normalized_connected_QFT": true,
    "constant_remains_physical_for_gravity": true,
    "constant_survives_QJ1_QJ2": true,
    "counterterm_space": "C_even=span{1,h^2,h^4}",
    "first_second_jet_matrix": [
      [
        "3",
        "27/2"
      ],
      [
        "2",
        "27"
      ]
    ],
    "nonconstant_coefficients": [
      "a",
      "b"
    ],
    "rational_witness_H": "3/2",
    "rational_witness_determinant": "54",
    "symbolic_QJ1_hessian_shift": "8 H^2 t",
    "symbolic_determinant": "16 H^3",
    "symbolic_matrix": "[[2H,4H^3],[2,12H^2]]",
    "unique_counterterm_formula": {
      "a": "(3b1-Hb2)/(4H)",
      "b": "(Hb2-b1)/(8H^3)"
    }
  },
  "frontier_delta": "The finite radial scheme problem is reduced from separate QJ1/QJ2 scalar conditions to one source-preserving pointed quantum-projection existence certificate. Ward/QME/PPA identities alone are proved insufficient.",
  "parameter_ledger": {
    "QJ1_QJ2_scalar_matching_conditions_reclassified_as_independent_knobs": 0,
    "new_fits": 0,
    "new_observed_inputs": 0,
    "new_physical_continuous_parameters": 0,
    "new_physical_discrete_selectors": 0,
    "new_structural_existence_certificates_required": 1,
    "remaining_additive_constant_if_gravity_included": 1,
    "remaining_additive_constant_in_normalized_connected_QFT": 0,
    "required_certificate": "source-preserving pointed quantum projection"
  },
  "physical_boundary": {
    "acceptance_counters_change": false,
    "gravitational_QJ0_selected": false,
    "physical_QJ1_selected": false,
    "physical_QJ2_selected": false,
    "physical_interacting_q79_BV_endpoint_executed": false,
    "physical_tangent_metric_selected": false,
    "provider_contract_level_selector_proved": true,
    "selected_physical_provider_instance_present": false,
    "selected_physical_quantum_projection_present": false
  },
  "physical_packets_accepted": 0,
  "physical_packets_total": 3,
  "physical_rows_accepted": 0,
  "physical_rows_total": 7,
  "radial_state_route": {
    "Legendre_identity": "dGamma/dh=J",
    "forced_radial_expectation": "omega(h)=H",
    "formal_local_state_extension_exists": true,
    "full_gauge_matter_state_uniqueness_required_for_radial_QJ1": false,
    "full_interacting_state_unique": false,
    "selected_physical_state_pushforward_present": false,
    "state_pushforward_clause": "the selected lower zero-source state is Pi_* of the upper invariant state",
    "unique_upper_radial_marginal": true,
    "upper_radial_invariant_state": "delta_H",
    "zero_source_then_QJ1": true
  },
  "schema": "boe.mtt.source-preserving-pointed-quantum-projection.v1",
  "selection_theorem": {
    "QJ1_and_action_QJ2_are_independent_numeric_knobs": false,
    "QJ1_follows_from_one_morphism": true,
    "action_jet_QJ2_follows_from_same_morphism": true,
    "classification": "IMPLICATION_CLOSED_EXISTENCE_OPEN",
    "fixed_point_implication": "X_up(u_*)=0 and DPi X_up(u_*)=X_Gamma(H) imply X_Gamma(H)=0",
    "gradient_implication": "X_Gamma(H)=0 with positive invertible g_H implies dGamma(H)=0",
    "nonconstant_SP_representative_is_unique_given_morphism": true,
    "physical_metric_normalized_QJ2_proved": false,
    "primitive_q79_realization_proved": false,
    "selected_morphism_existence_proved": false,
    "tangent_implication": "DPi A_up=A_Gamma DPi plus tangent isometry transports the action Hessian",
    "unique_representative_is_T39_anchor": true
  },
  "source_preserving_projection_contract": {
    "A35_insertion_magnitude": 1.0,
    "A35_selected_dimensionless_radial_coordinate": true,
    "A35_selects_physical_action_weight": false,
    "accepted_physical_provider_instance_present": false,
    "clauses": {
      "SP0": "one root provenance and no observed target used as source data",
      "SP1": "Pi(u_*)=H",
      "SP2": "DPi X_up(u_*)=X_Gamma(H)",
      "SP3": "DPi A_up=A_Gamma DPi on the selected tangent image",
      "SP4": "DPi is an isometry for the selected tangent pairings",
      "SP5": "BV/QME and normalized state pushforwards commute with Pi"
    },
    "full_nonlinear_flow_equality_required": false,